{
  "document": {
    "id": "efta00014405",
    "filename": "EFTA00014405.pdf",
    "path": "C:\\Users\\user\\CascadeProjects\\epsteinexposed\\apps\\web\\DataSet 8\\VOL00008\\IMAGES\\0002\\EFTA00014405.pdf",
    "text": "\n\nFrom: ' \nTo:  \nCc: , \" \n\" \nSubject: Re: travel approval request \nDate: Wed, 19 Feb 2020 16:08:06 +0000 \nThanks very much \nSent from my intone \nOn Feb 19, 2020, at 08:41, > wrote: \nGood \nmorning \n= \nYes, informed me that the documentation for the conference room was filled out and confirmed for your \nmeeting for today from 5:00pm -  8:00pm as specified. \nU.S. Attorney's Office (SONY) \nLegal Assistant, Public Corruption \nFrom: \nSent: Tuesday, February 18, 2020 11:58 AM \nTo: \nCc: \nSubject: RE: travel approval request \n)(S \n< \n> \nWanted to follow up on this —  please let us know? I can call them directly if that's necessary. Thanks! \nFrom: \nSent: Monday, February 17, 2020 13:03 \nTo: \nCc: \nc\"; \nSubject: FW: travel approval request \nRe: the below, I just got a bounce-back from that she's out tomorrow. Is this something one of you might be \nable to check and/or assist with? Or should I just do it myself tomorrow? \nthanks, \nFrom: \nSent: Monday, February 17, 2020 13:02 \nTo: \nEFTA00014405\n\nCc: \nSubject: RE: travel approval request \nWanted to see if you had reserved a conference room for us, per the below from Thursday? I got a confirmation for the \nhotel (attached) but it doesn't seem to say anything about a conference room. Could you please let us know either \nway? And if not yet, could you please reserve that for us tomorrow (Tuesday) and let us know when it's finalized? \nthank you! \nFrom: \nSent: Thursday, February 13, 2020 13:26 \nTo: \nCc: \nSubject: RE: travel approval request \nApologies for the slight delay yesterday on this travel, we had a witness scheduling issue so the travel will be a day later \nthan originally anticipated. The city is Pensacola, Florida, and it will be me and (rather than and \nif you could please book me on the following flights: \nFeb. 19: Delta, LGA to PNS, 9:00 a.m. (arriving 12:49 p.m.) \nFeb. 20: Delta, PNS to LGA, 4:06 p.m. (arriving 9:41 p.m.) \nAnd the following hotel, for the night of Feb. 19: \n- Hilton Garden Inn (listed in E2 as \"HGI PENSACOLA AIRPORT MEDICAL\") \nWe will also need a conference room at the Hilton Garden Inn for February 19, starting at 5:00 p.m. for three hours (or \nfor the entire day, if that's the only way they'll do it). \nPlease let us know if any questions or issues, and thanks as always. \nFrom: \nSent: Wednesday, February 12, 2020 09:02 \nTo: \nCc: \nSubject: Re: travel approval request \n>; \n•c> \nHi, \nWhich specific city will the hotel be in? \nIf could push the travel authorizations thru to • & I today, that would be great.... As well as sending the \nconference room payment request to \nRemember to take the FL tax exempt form along with you. \nEFTA00014406\n\nThanks \nSent from my iPhone \nOn Feb 12, 2020, at 6:43 AM, \nApproved \nSent from my iPad \nOn Feb 11, 2020, at 7:53 PM, \na \n> \nwrote: \nwrote: \nSimilar to prior requests in connection with the Epstein investigation (2018R01618), and I would like to please \nrequest permission for the two of us to travel next week for an interview of a witness in Pensacola, Florida on 2/19. \nWe'd plan to fly down on 2/18 and fly back on 2/19. Also, similar to prior requests, we'd like to request approval to \nget a conference room on 2/19. \nThank you, \nFrom: \nSent: Tuesday, January 21, 2020 2:56 PM \nTo: \nCc: \nSubject: RE: travel approval request \nApproved \nFrom: \nSent: Tuesday, January 21, 2020 2:49 PM \nTo: \nCc: \nSubject: RE: travel approval request \nSimilar to prior requests in connection with the Epstein investigation (2018R01618), but with an added international \nelement, we'd like to please request permission for the team to travel next week for an interview near Stockholm, \nSweden, next week on January 29th and/or 30th. We expect to be traveling, respectively, some combination of the \n27th (overnight) to the 31st, depending on when the interview ends up being scheduled, and we'll put final dates on \nour formal applications. Also similar to prior trips, we'd like to request approval to get a conference room for one of \nthose days at a hotel for the interview itself. \nAlso based on our discussion earlier we'll be mindful of looking for domestic (or domestic-flagged) carrier flights, as \nwell as the costs of any alternatives, in looking at possible specific bookings. Thanks as always for your help and \ninput on that. \nthank you, \nEFTA00014407\n\nFrom: \nSent: Wednesday, December 11, 2019 09:58 \nTo: \nCc: >; \nSubject: RE: travel approval request \nS \nSimilar to prior requests in connection with the Epstein investigation (2018R01618), we'd like to please request \npermission for the team to travel next week for an interview (or possibly interviews) in Los Angeles on December 16 \nand/or 17. We expect to be traveling, respectively, some combination of the 15th to the 18th. Also similar to prior \ntrips, we'd like to request approval to get a conference room for one of those days. \nthank you, \nFrom: \nSent: Tuesday, November 05, 2019 16:53 \nTo: \nCc: \nSubject: RE: travel approval request \nS \n>; \nSimilar to prior requests in connection with the Epstein investigation (2018R01618), we'd like to please request \npermission for the team to travel next week for an interview in Los Angeles on November 14. We expect to be \ntraveling, respectively, some combination of the 13th to the 15th (and no conference room necessary for this trip). \nthanks, \nFrom: \nSent: Tuesday, October 22, 2019 13:55 \nTo: \nCc: < \nSubject: RE: travel approval request \nS \nSimilar to prior requests in connection with the Epstein investigation (2018R01618), we'd like to please request \npermission to travel next week for an interview in West Palm Beach on November 4. It will just be me and \nand we'll travel some combination of the 3rd to the 5th. And also same as last time, we'd like to ask permission to \nreserve a conference room at the hotel on that Monday for the interview, please. \nEFTA00014408\n\nthanks very much, \nFrom: \nSent: Wednesday, June 12, 2019 14:51 \nTo: \nCc: \nSubject: RE: travel approval request \nAgain in connection with the Epstein investigation (2018R01618), we'd like to please request permission to travel \nnext week for a victim interview in Los Angeles. As of now we tentatively expect to fly down Wednesday and return \nno later than Friday (and will keep the timeframe as short as scheduling allows). The trip will be some combination \nof me, M, and/or as previously. And also same as last time, we'd like to ask permission to reserve a \nconference room at the hotel on Thursday for the interview, please. \nthanks very much, \nFrom: \nSent: Friday, May 24, 2019 14:57 \nTo: \nCc: \nSubject: RE: travel approval request \n<>; \nAgain in connection with the Epstein investigation, we'd like to please request permission to travel for approximately \nthree days next week for meetings and interviews in West Palm Beach, Florida. As of now we tentatively expect to \nfly down Tuesday night and return on Wednesday or Thursday (and will keep the timeframe as short as scheduling \nallows). \nUnfortunately we're still trying to pin down timing for interviewing the victims, so depending on the timing it will \neither be me and or and but we wanted to ask for permission now either way so we weren't \ndoing it super last minute after the holiday on Tuesday. And also same as last time, we'd like to ask permission to \nreserve a conference room at the hotel for the interviews, please. \nthanks very much, \nFrom: \nSent: Wednesday, April 03, 2019 20:57 \nTo: \nSubject: RE: travel approval request \nThank you \nFrom: \nSent: Wednesday, April 03, 2019 20:46 \nEFTA00014409\n\nTo: \nCc: \nSubject: Re: travel approval request \nApproved \nSent from my iPad \nOn Apr 3, 2019, at 8:02 PM, \nj \n< \n> \nwrote: \nS \nFor the same case as below, United States v. Epstein, 2018R01618, an investigation relating to enticement of minors \nfor sexual activity, and I would like to please request permission to travel for approximately three days next \nweek for meetings and interviews in West Palm Beach, Florida. As of now we tentatively expect to fly down \nTuesday night and return on Friday, though we will shorten the timeframe if scheduling allows. \nPlease let us know if any other information would be helpful, and thanks very much. \nFrom: \nSent: Thursday, March 14, 2019 18:32 \nTo: \nCc: \n<> \nSubject: travel approval request \nS \n> \nand I would like to please request permission for travel for United States v. Epstein, 2018R01618, an \ninvestigation relating to enticement of minors for sexual activity, for two days of meetings and interviews in West \nPalm Beach and/or Fort Lauderdale, Florida. As of now we're hoping to fly down next Wednesday night and return \non Saturday. \nPlease let us know if any other information would be helpful, and thanks as always. \nAssistant U.S. Attorney \nSouthern District of New York \nEFTA00014410",
    "pageCount": 6,
    "dataset": "Dataset 8"
  },
  "entities": {
    "people": [
      {
        "name": "On Feb",
        "role": "extracted",
        "context": "ry much \nSent from my intone \nOn Feb 19, 2020, at 08:41, > wrote:"
      },
      {
        "name": "Legal Assistant",
        "role": "extracted",
        "context": ".S. Attorney's Office (SONY) \nLegal Assistant, Public Corruption \nFrom: \nSe"
      },
      {
        "name": "Public Corruption",
        "role": "extracted",
        "context": "fice (SONY) \nLegal Assistant, Public Corruption \nFrom: \nSent: Tuesday, Februa"
      },
      {
        "name": "Hilton Garden",
        "role": "extracted",
        "context": "for the night of Feb. 19: \n- Hilton Garden Inn (listed in E2 as \"HGI PEN"
      },
      {
        "name": "Thanks \nSent",
        "role": "extracted",
        "context": "long with you. \nEFTA00014406\n\nThanks \nSent from my iPhone \nOn Feb 12, 20"
      },
      {
        "name": "Phone \nOn",
        "role": "extracted",
        "context": "014406\n\nThanks \nSent from my iPhone \nOn Feb 12, 2020, at 6:43 AM, \nAp"
      },
      {
        "name": "Approved \nSent",
        "role": "extracted",
        "context": "On Feb 12, 2020, at 6:43 AM, \nApproved \nSent from my iPad \nOn Feb 11, 2020"
      },
      {
        "name": "Pad \nOn",
        "role": "extracted",
        "context": "AM, \nApproved \nSent from my iPad \nOn Feb 11, 2020, at 7:53 PM, \na"
      },
      {
        "name": "Approved \nFrom",
        "role": "extracted",
        "context": "RE: travel approval request \nApproved \nFrom: \nSent: Tuesday, January 21,"
      },
      {
        "name": "West Palm",
        "role": "extracted",
        "context": "next week for an interview in West Palm Beach on November 4. It will"
      },
      {
        "name": "West \nPalm",
        "role": "extracted",
        "context": "of meetings and interviews in West \nPalm Beach and/or Fort Lauderdale,"
      },
      {
        "name": "Fort Lauderdale",
        "role": "extracted",
        "context": "ws in West \nPalm Beach and/or Fort Lauderdale, Florida. As of now we're hop"
      },
      {
        "name": "Attorney \nSouthern",
        "role": "extracted",
        "context": "ks as always. \nAssistant U.S. Attorney \nSouthern District of New York \nEFTA000"
      }
    ],
    "locations": [
      {
        "name": "Palm Beach",
        "type": "location"
      },
      {
        "name": "LGA",
        "type": "airport"
      }
    ],
    "dates": [
      {
        "date": "2020-02-18",
        "event": "February 18, 2020"
      },
      {
        "date": "2020-02-17",
        "event": "February 17, 2020"
      },
      {
        "date": "2020-02-13",
        "event": "February 13, 2020"
      },
      {
        "date": "2020-02-12",
        "event": "February 12, 2020"
      },
      {
        "date": "2020-01-21",
        "event": "January 21, 2020"
      },
      {
        "date": "2019-12-11",
        "event": "December 11, 2019"
      },
      {
        "date": "2019-11-05",
        "event": "November 05, 2019"
      },
      {
        "date": "2019-10-22",
        "event": "October 22, 2019"
      },
      {
        "date": "2019-06-12",
        "event": "June 12, 2019"
      },
      {
        "date": "2019-05-24",
        "event": "May 24, 2019"
      },
      {
        "date": "2019-04-03",
        "event": "April 03, 2019"
      },
      {
        "date": "2019-03-14",
        "event": "March 14, 2019"
      }
    ],
    "flights": [
      {
        "from": "LGA",
        "to": "PNS",
        "date": "unknown",
        "passengers": []
      },
      {
        "from": "PNS",
        "to": "LGA",
        "date": "unknown",
        "passengers": []
      }
    ],
    "phone_numbers": [],
    "organizations": []
  },
  "processedAt": "2025-12-23T12:25:48.793Z"
}