{
  "document": {
    "id": "efta00010268",
    "filename": "EFTA00010268.pdf",
    "path": "C:\\Users\\user\\CascadeProjects\\epsteinexposed\\apps\\web\\DataSet 8\\VOL00008\\IMAGES\\0001\\EFTA00010268.pdf",
    "text": "\n\nFrom: ' \nTo: ' \nSubject: RE: travel approval request \nDate: Mon, 28 Oct 2019 16:49:06 +0000 \nHi \nYes, thanks — could you please make these bookings: \nMonday, Nov. 4, 7:30 a.m., JetBlue, LGA to PBI (arriving 10:22 a.m.) \nNov. 4 to Nov. 5, reservation at Hilton West Palm Beach \nNov. 4, conference room reservation at Hilton West Palm Beach (if you could please have me be listed as the contact \nperson, and put it on my travel card, that seems to be easiest for them in terms of logistics when we're there) \nTuesday, Nov. 5, 7:53 a.m., JetBlue, HI to JFK (arriving 10:27 a.m.) \nI think that's everything, but please let me know if I'm forgetting anything or if any other info would be useful, and thanks \nas always. \nFrom: \nSent: Monday, October 28, 2019 09:27 \nTo: \nSubject: RE: travel approval request \nGood morning M. \nHave you finalized the dates and location for your trip to West Palm Beach, FL scheduled between Nov 3 —  5th? I'd like to \nstart the reservation process for the airfare, hotel and amount of days you'll need a conference room. Let me know ASAP \nso your preferred options don't sell out. Thanks as always. \nU.S. Attorney's Office (SDNY) \nLegal Assistant, Public Corruption \nFrom: \nSent: Tuesday, October 22, 2019 2:03 PM \nTo: \nCc: \nSubject: RE: travel approval request \nThanks very much. \nFrom: \nSent: Tuesday, October 22, 2019 14:00 \nTo: \nCc: \nEFTA00010268\n\nSubject: RE: travel approval request \nApproved for both and the conference room. \nFrom: \nSent: Tuesday, October 22, 2019 1:55 PM \nTo: \nCc: \n> \nSubject: RE: travel approval request \nS \nSimilar to prior requests in connection with the Epstein investigation (2018R01618), we'd like to please request \npermission to travel next week for an interview in West Palm Beach on November 4. It will just be me and and \nwe'll travel some combination of the 3rd to the 5th. And also same as last time, we'd like to ask permission to reserve a \nconference room at the hotel on that Monday for the interview, please. \nthanks very much, \nFrom: \nSent: Wednesday, June 12, 2019 14:51 \nTo: \nCc: \nSubject: RE: travel approval request \nS \nAgain in connection with the Epstein investigation (2018R01618), we'd like to please request permission to travel next \nweek for a victim interview in Los Angeles. As of now we tentatively expect to fly down Wednesday and return no later \nthan Friday (and will keep the timeframe as short as scheduling allows). The trip will be some combination of me, M, \nand/or as previously. And also same as last time, we'd like to ask permission to reserve a conference room at \nthe hotel on Thursday for the interview, please. \nthanks very much, \nFrom: \nSent: Friday, May 24, 2019 14:57 \nTo: \nCc: \nSubject: RE: travel approval request \nS \nAgain in connection with the Epstein investigation, we'd like to please request permission to travel for approximately \nthree days next week for meetings and interviews in West Palm Beach, Florida. As of now we tentatively expect to fly \ndown Tuesday night and return on Wednesday or Thursday (and will keep the timeframe as short as scheduling allows). \nEFTA00010269\n\nUnfortunately we're still trying to pin down timing for interviewing the victims, so depending on the timing it will either \nbe me and or and but we wanted to ask for permission now either way so we weren't doing it \nsuper last minute after the holiday on Tuesday. And also same as last time, we'd like to ask permission to reserve a \nconference room at the hotel for the interviews, please. \nthanks very much, \nFrom: \nSent: Wednesday, April 03, 2019 20:57 \nTo: \nSubject: RE: travel approval request \nThank you \nFrom: \nSent: Wednesday, April 03, 2019 20:46 \nTo: \nCc: \nSubject: Re: travel approval request \nApproved \nSent from my iPad \nOn Apr 3, 2019, at 8:02 PM, \nS \n> \nwrote: \nFor the same case as below, United States v. Epstein, 2018R01618, an investigation relating to enticement of minors for \nsexual activity, and I would like to please request permission to travel for approximately three days next week for \nmeetings and interviews in West Palm Beach, Florida. As of now we tentatively expect to fly down Tuesday night and \nreturn on Friday, though we will shorten the timeframe if scheduling allows. \nPlease let us know if any other information would be helpful, and thanks very much. \nFrom: \nSent: Thursday, March 14, 2019 18:32 \nTo: \nCc: \nSubject: travel approval request \nand I would like to please request permission for travel for United States v. Epstein, 2018R01618, an \ninvestigation relating to enticement of minors for sexual activity, for two days of meetings and interviews in West Palm \nBeach and/or Fort Lauderdale, Florida. As of now we're hoping to fly down next Wednesday night and return on \nSaturday. \nPlease let us know if any other information would be helpful, and thanks as always. \nEFTA00010270\n\nM \nAssistant U.S. Attorney \nSouthern District of New York \nEFTA00010271",
    "pageCount": 4,
    "dataset": "Dataset 8"
  },
  "entities": {
    "people": [
      {
        "name": "Hi \nYes",
        "role": "extracted",
        "context": ", 28 Oct 2019 16:49:06 +0000 \nHi \nYes, thanks — could you please ma"
      },
      {
        "name": "Hilton West",
        "role": "extracted",
        "context": ". 4 to Nov. 5, reservation at Hilton West Palm Beach \nNov. 4, conferenc"
      },
      {
        "name": "Palm Beach",
        "role": "extracted",
        "context": "5, reservation at Hilton West Palm Beach \nNov. 4, conference room rese"
      },
      {
        "name": "West Palm",
        "role": "extracted",
        "context": "and location for your trip to West Palm Beach, FL scheduled between N"
      },
      {
        "name": "Legal Assistant",
        "role": "extracted",
        "context": ".S. Attorney's Office (SDNY) \nLegal Assistant, Public Corruption \nFrom: \nSe"
      },
      {
        "name": "Public Corruption",
        "role": "extracted",
        "context": "fice (SDNY) \nLegal Assistant, Public Corruption \nFrom: \nSent: Tuesday, Octobe"
      },
      {
        "name": "Approved \nSent",
        "role": "extracted",
        "context": "Re: travel approval request \nApproved \nSent from my iPad \nOn Apr 3, 2019,"
      },
      {
        "name": "Pad \nOn",
        "role": "extracted",
        "context": "uest \nApproved \nSent from my iPad \nOn Apr 3, 2019, at 8:02 PM, \nS"
      },
      {
        "name": "Fort Lauderdale",
        "role": "extracted",
        "context": "ws in West Palm \nBeach and/or Fort Lauderdale, Florida. As of now we're hop"
      },
      {
        "name": "Attorney \nSouthern",
        "role": "extracted",
        "context": "TA00010270\n\nM \nAssistant U.S. Attorney \nSouthern District of New York \nEFTA000"
      }
    ],
    "locations": [
      {
        "name": "Palm Beach",
        "type": "location"
      },
      {
        "name": "Jfk",
        "type": "location"
      },
      {
        "name": "JFK",
        "type": "airport"
      },
      {
        "name": "LGA",
        "type": "airport"
      },
      {
        "name": "PBI",
        "type": "airport"
      },
      {
        "name": "Palm Beach, FL",
        "type": "city"
      }
    ],
    "dates": [
      {
        "date": "2019-10-28",
        "event": "October 28, 2019"
      },
      {
        "date": "2019-10-22",
        "event": "October 22, 2019"
      },
      {
        "date": "2019-06-12",
        "event": "June 12, 2019"
      },
      {
        "date": "2019-05-24",
        "event": "May 24, 2019"
      },
      {
        "date": "2019-04-03",
        "event": "April 03, 2019"
      },
      {
        "date": "2019-03-14",
        "event": "March 14, 2019"
      }
    ],
    "flights": [
      {
        "from": "LGA",
        "to": "PBI",
        "date": "unknown",
        "passengers": []
      }
    ],
    "phone_numbers": [],
    "organizations": []
  },
  "processedAt": "2025-12-23T12:25:41.633Z"
}