{
  "document": {
    "id": "efta00028805",
    "filename": "EFTA00028805.pdf",
    "path": "C:\\Users\\user\\CascadeProjects\\epsteinexposed\\apps\\web\\DataSet 8\\VOL00008\\IMAGES\\0006\\EFTA00028805.pdf",
    "text": "\n\nFrom: ' \nTo:' \nSubject: RE: travel approval request \nDate: Tue, 22 Oct 2019 19:04:45 +0000 \nThanks I'm planning to fly down on the morning of 11/4 and fly back that same day. Would it be possible to \nplease book me on the 7:30am JetBlue flight from LGA to HI, and the 7:12pm JetBlue flight from PBI to LGA, both on \n11/4? \nFrom: \nSent: Tuesday, October 22, 2019 2:03 PM \nTo: \n >; \nCc: \nSubject: RE: travel approval request \nGood afternoon all, \nPlease let me know your preferred schedules for your trip to West Palm Beach, FL, and I'll get started on making the \nreservations for airfare and hotel ASAP. Thanks. \nU.S. Attorney's Office (SDNY) \nLegal Assistant, Public Corruption \nFrom: \nSent: Tuesday, October 22, 2019 2:00 PM \nTo: \nCc: \nSubject: RE: travel approval request \nApproved for both and the conference room. \nFrom: \nSent: Tuesday, October 22, 2019 1:55 PM \nTo: \nCc: \n>; \nSubject: RE: travel approval request \nU \nSimilar to prior requests in connection with the Epstein investigation (2018R01618), we'd like to please request \npermission to travel next week for an interview in West Palm Beach on November 4. It will just be me and and \nwe'll travel some combination of the 3rd to the 5th. And also same as last time, we'd like to ask permission to reserve a \nconference room at the hotel on that Monday for the interview, please. \nthanks very much, \nEFTA00028805\n\nFrom: \nSent: Wednesday, June 12, 2019 14:51 \nTo: \nCc: \nSubject: RE: travel approval request \nS \nAgain in connection with the Epstein investigation (2018R01618), we'd like to please request permission to travel next \nweek for a victim interview in Los Angeles. As of now we tentatively expect to fly down Wednesday and return no later \nthan Friday (and will keep the timeframe as short as scheduling allows). The trip will be some combination of me, M, \nand/or as previously. And also same as last time, we'd like to ask permission to reserve a conference room at \nthe hotel on Thursday for the interview, please. \nthanks very much, \nFrom: \nSent: Friday, May 24, 2019 14:57 \nTo: \nCc: \n> \nSubject: RE: travel approval request \nS \nAgain in connection with the Epstein investigation, we'd like to please request permission to travel for approximately \nthree days next week for meetings and interviews in West Palm Beach, Florida. As of now we tentatively expect to fly \ndown Tuesday night and return on Wednesday or Thursday (and will keep the timeframe as short as scheduling allows). \nUnfortunately we're still trying to pin down timing for interviewing the victims, so depending on the timing it will either \nbe me and or and but we wanted to ask for permission now either way so we weren't doing it \nsuper last minute after the holiday on Tuesday. And also same as last time, we'd like to ask permission to reserve a \nconference room at the hotel for the interviews, please. \nthanks very much, \nFrom: \nSent: Wednesday, April 03, 2019 20:57 \nTo: \nSubject: RE: travel approval request \nThank you \nFrom: \nSent: Wednesday, April 03, 2019 20:46 \nTo: \nCc: \nSubject: Re: travel approval request \n> \nEFTA00028806\n\nApproved \nSent from my iPad \nOn Apr 3, 2019, at 8:02 PM, \nS \n> \nwrote: \nFor the same case as below, United States v. Epstein, 2018R01618, an investigation relating to enticement of minors for \nsexual activity, and I would like to please request permission to travel for approximately three days next week for \nmeetings and interviews in West Palm Beach, Florida. As of now we tentatively expect to fly down Tuesday night and \nreturn on Friday, though we will shorten the timeframe if scheduling allows. \nPlease let us know if any other information would be helpful, and thanks very much. \nFrom: \nSent: Thursday, March 14, 2019 18:32 \nTo: \nCc: \nSubject: travel approval request \nS \nand I would like to please request permission for travel for United States v. Epstein, 2018R01618, an \ninvestigation relating to enticement of minors for sexual activity, for two days of meetings and interviews in West Palm \nBeach and/or Fort Lauderdale, Florida. As of now we're hoping to fly down next Wednesday night and return on \nSaturday. \nPlease let us know if any other information would be helpful, and thanks as always. \nAssistant U.S. Attorney \nSouthern District of New York \nEFTA00028807",
    "pageCount": 3,
    "dataset": "Dataset 8"
  },
  "entities": {
    "people": [
      {
        "name": "West Palm",
        "role": "extracted",
        "context": "ed schedules for your trip to West Palm Beach, FL, and I'll get start"
      },
      {
        "name": "Legal Assistant",
        "role": "extracted",
        "context": ".S. Attorney's Office (SDNY) \nLegal Assistant, Public Corruption \nFrom: \nSe"
      },
      {
        "name": "Public Corruption",
        "role": "extracted",
        "context": "fice (SDNY) \nLegal Assistant, Public Corruption \nFrom: \nSent: Tuesday, Octobe"
      },
      {
        "name": "Approved \nSent",
        "role": "extracted",
        "context": "val request \n> \nEFTA00028806\n\nApproved \nSent from my iPad \nOn Apr 3, 2019,"
      },
      {
        "name": "Pad \nOn",
        "role": "extracted",
        "context": "8806\n\nApproved \nSent from my iPad \nOn Apr 3, 2019, at 8:02 PM, \nS"
      },
      {
        "name": "Fort Lauderdale",
        "role": "extracted",
        "context": "ws in West Palm \nBeach and/or Fort Lauderdale, Florida. As of now we're hop"
      },
      {
        "name": "Attorney \nSouthern",
        "role": "extracted",
        "context": "ks as always. \nAssistant U.S. Attorney \nSouthern District of New York \nEFTA000"
      }
    ],
    "locations": [
      {
        "name": "Palm Beach",
        "type": "location"
      },
      {
        "name": "LGA",
        "type": "airport"
      },
      {
        "name": "PBI",
        "type": "airport"
      },
      {
        "name": "Palm Beach, FL",
        "type": "city"
      }
    ],
    "dates": [
      {
        "date": "2019-10-22",
        "event": "October 22, 2019"
      },
      {
        "date": "2019-06-12",
        "event": "June 12, 2019"
      },
      {
        "date": "2019-05-24",
        "event": "May 24, 2019"
      },
      {
        "date": "2019-04-03",
        "event": "April 03, 2019"
      },
      {
        "date": "2019-03-14",
        "event": "March 14, 2019"
      }
    ],
    "flights": [
      {
        "from": "PBI",
        "to": "LGA",
        "date": "unknown",
        "passengers": []
      }
    ],
    "phone_numbers": [],
    "organizations": []
  },
  "processedAt": "2025-12-23T12:26:21.022Z"
}