{
  "document": {
    "id": "efta00005783",
    "filename": "EFTA00005783.pdf",
    "path": "C:\\Users\\user\\CascadeProjects\\epsteinexposed\\apps\\web\\DataSet 4\\VOL00004\\IMAGES\\0001\\EFTA00005783.pdf",
    "text": "\n\nCELL\nMine \nA\nrA-TerD \nYD \nA \netv-e- \n4ety \n/\n,/ \n-\ny\nozvic\ni \nw/ \nm\n)\n.9/ \nn\n_\nv\n_\ne\n_ \nbvic.ogiwtho\nA\nl \nShe \nAnt' \n0\n7\n0\n/ve. \nsame \n,e \n/if \n/4.4r-,\n6\n/\n4\n   \nbvi\n-\n-eAuie \nti \nre \n3\n,4\n/2 \nel \nfAt5 \n\" \nV/ \nCTI \nnatairr. \n[Rom \n41. \n-7 \nC \na \neta, \nNC \n2 \nf?, \n// \n1-72 \n77,0 \ndi< \ne \nA4/%20 \ne, \nNC \nZ \n// \nEFTA00005783\n\nNJP \nResponse \nPage 1 of 2 \nUnautharind Dan!, reproduction. \nor \ndissemination \nIt \nprohibited. \nRE CEIVED AT 08'29/2019 \nIC:45:54 \nDR.NCDCI0000 \n10:45 \n08/29/2019 08353 \n10:45 08/29/2019 \n05727 NY10100T2 \n'04517928D7 \nTXT \nNAME: \nRESIDENCE ADDRESS: \nCOUNTRY: UNITED STATES \nDATE OF BIRTH: \nHEIGHT: \n508 \nEYE COLOR: BLUE \nHAIR COLOR: BLONDE \nGENDER: Female \nRACE: \nwhite \nDRIVER LICENSE DETAILS *** \nDRIVER AUTHORIZATION ID: \nJURISDICTION AUTHORITY CODE: NC \nISSUE DATE: 2019-07-31 \nCHARLOTTE,NC \n282113896 \nhttps://www.ejustice.ny.gov/JWI/ViewMessagejsp?msgid=27828988cpager.offset=0 8/29/2019 \nEFTA00005784\n\nNJP Response \nPage 2 of 2 \nEXPIRATION DATE: \n2027-07-01 \nDRIVER LICENSE PERMIT \nQUANTITY: 0 \nDRIVER LICENSE \nNON-COMMERCIAL CLASS: C \nDRIVER LICENSE \nNON-COMMERCIAL CLASS CODE: C \nLICENSED \nCOMMERCIAL DRIVER: NO \nLICENSED NON-COMMERCIAL DRIVER: \nYES \nDRIVER LICENSE NON-COMMERCIAL STATUS: CLS C \nACTIVE (CRD TRNS:0025384166 ) \nUnauthorized access, reproduction, \nor dissemination is prohibited. \nhups://wsvw.ejustice.ny.gov/JWINiewMessagejsp?msgid=2782898&pager.offset=0 8/29/2019 \nEFTA00005785\n\nEFTA00005786\n\nEFTA00005787\n\nEFTA00005788\n\nEFTA00005789\n\nEFTA00005790\n\nEFTA00005791\n\nEFTA00005792\n\nEFTA00005793\n\nEFTA00005794\n\nEFTA00005795\n\nEFTA00005796\n\nEFTA00005797\n\nEFTA00005798\n\nEFTA00005799\n\nEFTA00005800\n\nEFTA00005801\n\nEFTA00005802\n\nEFTA00005803\n\nEFTA00005804\n\nEFTA00005805\n\nEFTA00005806\n\nEFTA00005807\n\nEFTA00005808\n\nEFTA00005809\n\nEFTA00005810\n\nEFTA00005811\n\nEFTA00005812\n\nEFTA00005813\n\nEFTA00005814\n\nEFTA00005815\n\nEFTA00005816\n\nEFTA00005817",
    "pageCount": 35,
    "dataset": "Dataset 4"
  },
  "entities": {
    "people": [
      {
        "name": "She \nAnt",
        "role": "extracted",
        "context": "_\nv\n_\ne\n_ \nbvic.ogiwtho\nA\nl \nShe \nAnt' \n0\n7\n0\n/ve. \nsame \n,e \n/if"
      },
      {
        "name": "Response \nPage",
        "role": "extracted",
        "context": "NC \nZ \n// \nEFTA00005783\n\nNJP \nResponse \nPage 1 of 2 \nUnautharind Dan!, rep"
      },
      {
        "name": "Unautharind Dan",
        "role": "extracted",
        "context": "NJP \nResponse \nPage 1 of 2 \nUnautharind Dan!, reproduction. \nor \ndissemin"
      }
    ],
    "locations": [],
    "dates": [
      {
        "date": "2019-08-29",
        "event": "08/29/2019"
      },
      {
        "date": "2019-08-29",
        "event": "8/29/2019"
      },
      {
        "date": "2019-07-31",
        "event": "2019-07-31"
      },
      {
        "date": "2027-07-01",
        "event": "2027-07-01"
      }
    ],
    "flights": [],
    "phone_numbers": [
      "0025384166"
    ],
    "organizations": []
  },
  "processedAt": "2025-12-23T12:25:33.182Z"
}