{
  "document": {
    "id": "efta00024430",
    "filename": "EFTA00024430.pdf",
    "path": "C:\\Users\\user\\CascadeProjects\\epsteinexposed\\apps\\web\\DataSet 8\\VOL00008\\IMAGES\\0005\\EFTA00024430.pdf",
    "text": "\n\nFrom: HIMMES \naNIMME> \nTo: alMME>, \nSubject: RE: Travel \nDate: Wed, 28 Aug 2019 13:10:36 +0000 \n(USANYS)\" \nYes, lid like the same arrangements, if possible, please. Thank you! \n Ori inal Messa e \nFrom: ale \nSent: Wednesda August 28, 2019 9:03 AM \nTo:USANYS \nCc: \n  an \nSubject: Travel \nand I are traveling to West Palm Beach next week for the Epstein case. Could you please help book our \ntravel? Here is my informationâ€” can let you know whether she would like the same arrangements. \nThanks so much for your help. \nHotel: Hilton Palm Beach, 600 Okeechobee Blvd, West Palm Beach. Checking in on 9/3 and checking out 9/4. \nConference Room: please book a conference room at the Hilton for both Tuesday and Wednesday. If they have a \nroom called \"the social\" available, that would be great. \nFlights: \nOutbound, leaving at 920 am on 9/3 from EWR to PB1 \nInbound, leaving at 6:12 pm on 9/4 from PBI to JFK \nThanks! \nSent from my iPhone \nEFTA00024430",
    "pageCount": 1,
    "dataset": "Dataset 8"
  },
  "entities": {
    "people": [
      {
        "name": "Travel \nDate",
        "role": "extracted",
        "context": "E> \nTo: alMME>, \nSubject: RE: Travel \nDate: Wed, 28 Aug 2019 13:10:36 +0"
      },
      {
        "name": "Wednesda August",
        "role": "extracted",
        "context": "nal Messa e \nFrom: ale \nSent: Wednesda August 28, 2019 9:03 AM \nTo:USANYS"
      },
      {
        "name": "West Palm",
        "role": "extracted",
        "context": "ravel \nand I are traveling to West Palm Beach next week for the Epste"
      },
      {
        "name": "Hilton Palm",
        "role": "extracted",
        "context": "o much for your help. \nHotel: Hilton Palm Beach, 600 Okeechobee Blvd, W"
      },
      {
        "name": "Okeechobee Blvd",
        "role": "extracted",
        "context": "Hotel: Hilton Palm Beach, 600 Okeechobee Blvd, West Palm Beach. Checking in"
      },
      {
        "name": "Conference Room",
        "role": "extracted",
        "context": "on 9/3 and checking out 9/4. \nConference Room: please book a conference roo"
      }
    ],
    "locations": [
      {
        "name": "Palm Beach",
        "type": "location"
      },
      {
        "name": "Jfk",
        "type": "location"
      },
      {
        "name": "JFK",
        "type": "airport"
      },
      {
        "name": "PBI",
        "type": "airport"
      }
    ],
    "dates": [
      {
        "date": "2019-08-28",
        "event": "August 28, 2019"
      }
    ],
    "flights": [
      {
        "from": "PBI",
        "to": "JFK",
        "date": "unknown",
        "passengers": []
      }
    ],
    "phone_numbers": [],
    "organizations": []
  },
  "processedAt": "2025-12-23T12:26:11.132Z"
}